{
  "$schema": "./config.schema.json",
  "cover": {
    "autoGenerate": true,
    "skill": "image-gen",
    "provider": "google",
    "aspectRatio": "2.35:1",
    "defaultPromptPrefix": "A modern, clean cover image for: "
  },
  "inlineImages": {
    "enabled": true,
    "skill": "image-gen",
    "provider": "google",
    "defaultAspectRatio": "4:3",
    "quality": "2k",
    "outputDir": "attachments"
  },
  "convert": {
    "theme": "default"
  },
  "publish": {
    "method": "remote"
  }
}